{
  "version": 1,
  "skill": "module-design",
  "repo": "AlvaroVFon/auth-service",
  "updated": "2026-10-04",
  "entries": [
    {
      "id": "improvement-56670f357d19",
      "kind": "design",
      "title": "Ports declared in barrels are not implemented by the concrete services",
      "severity": "Major",
      "type": "improvement",
      "module": "users",
      "location": {
        "file": "src/users/index.ts",
        "line": 6,
        "symbol": "UsersPort"
      },
      "status": "resolved",
      "first_seen": "2026-10-04",
      "last_seen": "2026-10-04",
      "fixed_at": "2026-10-04",
      "fixed_commit": "1634c82",
      "commit": "960de3c",
      "evidence": {
        "type": "analysis",
        "detail": "users.service.ts / holders.service.ts / tenants.service.ts declare no implements clause."
      },
      "notes": [
        "2026-10-04 part 2: intent-based ports with implements; lockout policy owned by users; auth uses TokenBlacklistPort; facade has a consumer"
      ],
      "detail": "UsersPort/HoldersPort/TenantsPort live inside index.ts and the services (UsersService, HoldersService, TenantsService) never `implements` them. Compatibility is structural only, so a service change can silently break the contract at the composition root instead of failing to compile."
    },
    {
      "id": "leakage-back-door-1f877dfb8e88",
      "kind": "design",
      "title": "Validation logic and messages duplicated across five services",
      "severity": "Major",
      "type": "leakage-back-door",
      "module": "auth",
      "location": {
        "file": "src/auth/services/auth.service.ts",
        "line": 105,
        "symbol": "AuthService.signup"
      },
      "status": "open",
      "first_seen": "2026-10-04",
      "last_seen": "2026-10-04",
      "fixed_at": null,
      "fixed_commit": null,
      "commit": "960de3c",
      "evidence": {
        "type": "analysis",
        "detail": "Same if(!email)/EMAIL_REGEX/PASSWORD_REGEX blocks repeated in auth.service.ts, users.service.ts, holders.service.ts."
      },
      "notes": [],
      "detail": "Although EMAIL_REGEX/PASSWORD_REGEX/OBJECTID_REGEX now live in common/constants/regex, the surrounding guard-and-error logic is copied in AuthService (login/signup/reset), UsersService, HoldersService, CodesService and RefreshTokenService. Changing a rule or message still forces edits in five-plus files; no email/password value object owns the policy."
    },
    {
      "id": "leakage-back-door-5aa9bc762f79",
      "kind": "design",
      "title": "Reset-password code stores a User id in holderId with ref 'Holder'",
      "severity": "Major",
      "type": "leakage-back-door",
      "module": "auth/codes",
      "location": {
        "file": "src/auth/codes/codes.schema.ts",
        "line": 8,
        "symbol": "CodesSchema.holderId"
      },
      "status": "open",
      "first_seen": "2026-10-04",
      "last_seen": "2026-10-04",
      "fixed_at": null,
      "fixed_commit": null,
      "commit": "960de3c",
      "evidence": {
        "type": "back-door",
        "detail": "auth.service.ts:178-180 createForgotPasswordCode(user._id); codes.service.ts:62 create(userId, RESET_PASSWORD)."
      },
      "notes": [],
      "detail": "CodesService.create always writes to field holderId with ref 'Holder', but forgot-password passes a User id. The field name and mongoose ref no longer describe what is stored for RESET_PASSWORD codes, an implicit assumption shared between auth and codes."
    },
    {
      "id": "leakage-back-door-5fe4a7282c8f",
      "kind": "design",
      "title": "Holder expiry and code expiry share CODE_EXPIRATION_MS",
      "severity": "Major",
      "type": "leakage-back-door",
      "module": "holders",
      "location": {
        "file": "src/holders/holders.schema.ts",
        "line": 6,
        "symbol": "holderExpiration"
      },
      "status": "resolved",
      "first_seen": "2026-10-04",
      "last_seen": "2026-10-04",
      "fixed_at": "2026-10-04",
      "fixed_commit": "320ee04",
      "commit": "960de3c",
      "evidence": {
        "type": "back-door",
        "detail": "codes.service.ts:19 also reads CODE_EXPIRATION_MS."
      },
      "notes": [
        "2026-10-04 part 3: CodesService takes policy by constructor; holder TTL uses HOLDER_EXPIRATION_MS"
      ],
      "detail": "HoldersSchema derives its TTL from CODE_EXPIRATION_MS, the same env var that CodesService uses for one-time codes. Two unrelated concepts share one undeclared constant; changing code lifetime silently changes holder lifetime."
    },
    {
      "id": "leakage-back-door-add0dcf8d0ed",
      "kind": "design",
      "title": "updateOneById(Partial<User>) lets auth write internal user fields",
      "severity": "Major",
      "type": "leakage-back-door",
      "module": "users",
      "location": {
        "file": "src/auth/services/auth.service.ts",
        "line": 99,
        "symbol": "handleSuccessfulLogin"
      },
      "status": "resolved",
      "first_seen": "2026-10-04",
      "last_seen": "2026-10-04",
      "fixed_at": "2026-10-04",
      "fixed_commit": "1634c82",
      "commit": "960de3c",
      "evidence": {
        "type": "interface",
        "detail": "updateOneById(id: string, updateData: Partial<User>) exposed on UsersPort."
      },
      "notes": [
        "2026-10-04 part 2: intent-based ports with implements; lockout policy owned by users; auth uses TokenBlacklistPort; facade has a consumer"
      ],
      "detail": "AuthService resets loginAttempts/lockoutUntil through UsersPort.updateOneById(id, Partial<User>), so auth must know the user representation and can mutate any field (including password) without going through users' invariants (e.g. hashing is implicit). This is Tell-Don't-Ask broken across the boundary."
    },
    {
      "id": "leakage-back-door-f02e756b665c",
      "kind": "design",
      "title": "common RequiredBodyMiddleware hardcodes the /auth/logout route",
      "severity": "Major",
      "type": "leakage-back-door",
      "module": "common",
      "location": {
        "file": "src/common/middlewares/required-body.middleware.ts",
        "line": 3,
        "symbol": "EXCLUDED_PATHS"
      },
      "status": "open",
      "first_seen": "2026-10-04",
      "last_seen": "2026-10-04",
      "fixed_at": null,
      "fixed_commit": null,
      "commit": "960de3c",
      "evidence": {
        "type": "back-door",
        "detail": "required-body.middleware.ts:3 hardcodes an auth endpoint path."
      },
      "notes": [],
      "detail": "A generic common middleware embeds knowledge of an auth route via EXCLUDED_PATHS = ['/auth/logout']. This is the same class of shared-boundary assumption the TokenBlacklistPort refactor removed: common should be route-agnostic and receive the exclusion policy from the caller."
    },
    {
      "id": "leakage-interface-227ccbd8737b",
      "kind": "design",
      "title": "users port depends on holders' entity type",
      "severity": "Major",
      "type": "leakage-interface",
      "module": "users",
      "location": {
        "file": "src/users/index.ts",
        "line": 7,
        "symbol": "UsersPort.createFromHolder"
      },
      "status": "resolved",
      "first_seen": "2026-10-04",
      "last_seen": "2026-10-04",
      "fixed_at": "2026-10-04",
      "fixed_commit": "1634c82",
      "commit": "960de3c",
      "evidence": {
        "type": "interface",
        "detail": "users/index.ts imports { Holder } from '../holders'."
      },
      "notes": [
        "2026-10-04 part 2: intent-based ports with implements; lockout policy owned by users; auth uses TokenBlacklistPort; facade has a consumer"
      ],
      "detail": "UsersPort.createFromHolder(holder: Holder) makes the users module import the holders entity type, coupling two modules through a concrete representation instead of an explicit primitive (for example a VerifiedEmail value with email and password)."
    },
    {
      "id": "leakage-interface-e4012cfc12ec",
      "kind": "design",
      "title": "Mailer port mixes a general mechanism with business policy",
      "severity": "Major",
      "type": "leakage-interface",
      "module": "libs/mailer",
      "location": {
        "file": "src/libs/mailer/mailer.interface.ts",
        "line": 11,
        "symbol": "MailerInterface.sendWelcomeEmail"
      },
      "status": "open",
      "first_seen": "2026-10-04",
      "last_seen": "2026-10-04",
      "fixed_at": null,
      "fixed_commit": null,
      "commit": "960de3c",
      "evidence": {
        "type": "interface",
        "detail": "nodemailer.adapter.ts:7 imports { MailTemplate } from '../../../mail/mail.enum'."
      },
      "notes": [],
      "detail": "MailerInterface couples generic delivery (sendEmail/sendMailWithTemplate) with specific policy (sendWelcomeEmail/sendSignupVerificationEmail/sendResetPasswordEmail). The nodemailer adapter also imports MailTemplate from the mail/ domain folder, so infrastructure depends on a business enum. General mechanism and specific policy should be split."
    },
    {
      "id": "over-config-1e79bf7df611",
      "kind": "design",
      "title": "CodesService reads CODE_EXPIRATION_MS and CODE_LENGTH from env instead of being injected",
      "severity": "Major",
      "type": "over-config",
      "module": "auth/codes",
      "location": {
        "file": "src/auth/codes/codes.service.ts",
        "line": 19,
        "symbol": "CodesService.constructor"
      },
      "status": "resolved",
      "first_seen": "2026-10-04",
      "last_seen": "2026-10-04",
      "fixed_at": "2026-10-04",
      "fixed_commit": "320ee04",
      "commit": "960de3c",
      "evidence": {
        "type": "back-door",
        "detail": "codes.service.ts:19-20 getNumberEnvVariable('CODE_EXPIRATION_MS'/'CODE_LENGTH'); jwt.service.ts receives expiresIn injected."
      },
      "notes": [